{
  "schemaVersion": "1.0.0",
  "workspaceId": "AINVIL-WORKSPACE-ainvil",
  "product": "AInvil",
  "language": "ko",
  "pluginRoot": "E:\\wiseongjun\\ProgrammingNAssignment\\GameDesigner\\plugins\\ainvil",
  "unityProjectPath": "E:\\wiseongjun\\Unity\\DungeonRecoveryCompany",
  "docsPath": "E:\\wiseongjun\\ProgrammingNAssignment\\GameDesigner\\plugins\\ainvil\\docs",
  "graphPath": "E:\\wiseongjun\\ProgrammingNAssignment\\GameDesigner\\plugins\\ainvil\\state\\production_state_graph.json",
  "evidencePath": "E:\\wiseongjun\\ProgrammingNAssignment\\GameDesigner\\plugins\\ainvil\\validation\\evidence",
  "reportsPath": "E:\\wiseongjun\\ProgrammingNAssignment\\GameDesigner\\plugins\\ainvil\\reports",
  "unityBridgePackagePath": "E:\\wiseongjun\\ProgrammingNAssignment\\GameDesigner\\plugins\\ainvil\\unity-package\\Packages\\com.codex.unity-bridge",
  "unityBridgePackageRole": "Canonical source",
  "rootUnityPackageMirrorPath": "E:\\wiseongjun\\ProgrammingNAssignment\\GameDesigner\\UnityPackage\\Packages\\com.codex.unity-bridge",
  "rootUnityPackageMirrorRole": "Deprecated mirror/install artifact",
  "createdAt": "2026-07-02T22:32:47.741Z",
  "lastOpenedAt": "2026-07-06T06:13:09.156Z"
}
